{
	"$id": "https://schemas.gluondb.com/dashboard/authoring/operation-v1.schema.json",
	"title": "DashboardOperationDeclaration",
	"description": "Complete authoring-only dashboard operation declaration. Viewer contracts must never expose its SQL or datasource id.",
	"$schema": "https://json-schema.org/draft/2020-12/schema",
	"type": "object",
	"properties": {
		"key": {
			"$ref": "#/$defs/OperationKey"
		},
		"datasource_id": {
			"type": "string",
			"format": "uuid",
			"pattern": "^([0-9a-fA-F]{8}-[0-9a-fA-F]{4}-[1-8][0-9a-fA-F]{3}-[89abAB][0-9a-fA-F]{3}-[0-9a-fA-F]{12}|00000000-0000-0000-0000-000000000000|ffffffff-ffff-ffff-ffff-ffffffffffff)$"
		},
		"sql": {
			"$ref": "#/$defs/OperationSql"
		},
		"parameters": {
			"$ref": "#/$defs/OperationParameters"
		},
		"result_schema": {
			"$ref": "#/$defs/OperationResultSchema"
		}
	},
	"required": [
		"key",
		"datasource_id",
		"sql",
		"parameters"
	],
	"additionalProperties": false,
	"$defs": {
		"OperationKey": {
			"type": "string",
			"minLength": 1,
			"maxLength": 128,
			"pattern": "^[A-Za-z0-9][A-Za-z0-9_-]*$",
			"id": "OperationKey"
		},
		"OperationSql": {
			"type": "string",
			"minLength": 1,
			"maxLength": 65536,
			"id": "OperationSql",
			"description": "Authoring-only SQL. Bind parameters use exact, case-sensitive {{parameter_name}} placeholders."
		},
		"OperationParameters": {
			"type": "object",
			"propertyNames": {
				"$ref": "#/$defs/ParameterName"
			},
			"additionalProperties": {
				"$ref": "#/$defs/DashboardParameterDeclaration"
			},
			"id": "OperationParameters",
			"description": "At most 64 typed bind parameters. A declaration without a default is required at execution.",
			"maxProperties": 64
		},
		"ParameterName": {
			"type": "string",
			"minLength": 1,
			"maxLength": 64,
			"pattern": "^[A-Za-z_][A-Za-z0-9_]*$",
			"id": "ParameterName"
		},
		"DashboardParameterDeclaration": {
			"oneOf": [
				{
					"$ref": "#/$defs/BooleanParameter"
				},
				{
					"$ref": "#/$defs/IntegerParameter"
				},
				{
					"$ref": "#/$defs/NumberParameter"
				},
				{
					"$ref": "#/$defs/DateParameter"
				},
				{
					"$ref": "#/$defs/TimestampParameter"
				},
				{
					"$ref": "#/$defs/EnumParameter"
				},
				{
					"$ref": "#/$defs/UuidParameter"
				},
				{
					"$ref": "#/$defs/OperationValuesParameter"
				},
				{
					"$ref": "#/$defs/ArrayParameter"
				}
			],
			"id": "DashboardParameterDeclaration"
		},
		"BooleanParameter": {
			"type": "object",
			"properties": {
				"type": {
					"type": "string",
					"const": "boolean"
				},
				"default": {
					"type": "boolean"
				}
			},
			"required": [
				"type"
			],
			"additionalProperties": false,
			"id": "BooleanParameter"
		},
		"IntegerParameter": {
			"type": "object",
			"properties": {
				"type": {
					"type": "string",
					"const": "integer"
				},
				"minimum": {
					"type": "integer",
					"minimum": -9007199254740991,
					"maximum": 9007199254740991
				},
				"maximum": {
					"type": "integer",
					"minimum": -9007199254740991,
					"maximum": 9007199254740991
				},
				"default": {
					"type": "integer",
					"minimum": -9007199254740991,
					"maximum": 9007199254740991
				}
			},
			"required": [
				"type"
			],
			"additionalProperties": false,
			"id": "IntegerParameter"
		},
		"NumberParameter": {
			"type": "object",
			"properties": {
				"type": {
					"type": "string",
					"const": "number"
				},
				"minimum": {
					"type": "number"
				},
				"maximum": {
					"type": "number"
				},
				"default": {
					"type": "number"
				}
			},
			"required": [
				"type"
			],
			"additionalProperties": false,
			"id": "NumberParameter"
		},
		"DateParameter": {
			"type": "object",
			"properties": {
				"type": {
					"type": "string",
					"const": "date"
				},
				"default": {
					"$ref": "#/$defs/DashboardDateValue"
				}
			},
			"required": [
				"type"
			],
			"additionalProperties": false,
			"id": "DateParameter"
		},
		"DashboardDateValue": {
			"type": "string",
			"format": "date",
			"pattern": "^(?:(?:\\d\\d[2468][048]|\\d\\d[13579][26]|\\d\\d0[48]|[02468][048]00|[13579][26]00)-02-29|\\d{4}-(?:(?:0[13578]|1[02])-(?:0[1-9]|[12]\\d|3[01])|(?:0[469]|11)-(?:0[1-9]|[12]\\d|30)|(?:02)-(?:0[1-9]|1\\d|2[0-8])))$",
			"id": "DashboardDateValue"
		},
		"TimestampParameter": {
			"type": "object",
			"properties": {
				"type": {
					"type": "string",
					"const": "timestamp"
				},
				"default": {
					"$ref": "#/$defs/DashboardTimestampValue"
				}
			},
			"required": [
				"type"
			],
			"additionalProperties": false,
			"id": "TimestampParameter"
		},
		"DashboardTimestampValue": {
			"type": "string",
			"allOf": [
				{
					"pattern": "^(?:(?:\\d\\d[2468][048]|\\d\\d[13579][26]|\\d\\d0[48]|[02468][048]00|[13579][26]00)-02-29|\\d{4}-(?:(?:0[13578]|1[02])-(?:0[1-9]|[12]\\d|3[01])|(?:0[469]|11)-(?:0[1-9]|[12]\\d|30)|(?:02)-(?:0[1-9]|1\\d|2[0-8])))T(?:(?:[01]\\d|2[0-3]):[0-5]\\d(?::[0-5]\\d(?:\\.\\d+)?)?(?:Z|([+-](?:[01]\\d|2[0-3]):[0-5]\\d)))$"
				},
				{
					"pattern": "^\\d{4}-\\d{2}-\\d{2}T\\d{2}:\\d{2}:\\d{2}(?:\\.\\d{1,6})?(?:Z|\\+(?:(?:0\\d|1[0-3]):[0-5]\\d|14:00)|-(?:0\\d|1[0-3]):[0-5]\\d)$"
				}
			],
			"id": "DashboardTimestampValue"
		},
		"EnumParameter": {
			"type": "object",
			"properties": {
				"type": {
					"type": "string",
					"const": "enum"
				},
				"values": {
					"minItems": 1,
					"type": "array",
					"items": {
						"$ref": "#/$defs/DashboardEnumValue"
					}
				},
				"default": {
					"$ref": "#/$defs/DashboardEnumValue"
				}
			},
			"required": [
				"type",
				"values"
			],
			"additionalProperties": false,
			"id": "EnumParameter"
		},
		"DashboardEnumValue": {
			"type": "string",
			"maxLength": 512,
			"pattern": "^[^\\x00]*$",
			"id": "DashboardEnumValue"
		},
		"UuidParameter": {
			"type": "object",
			"properties": {
				"type": {
					"type": "string",
					"const": "uuid"
				},
				"default": {
					"type": "string",
					"format": "uuid",
					"pattern": "^([0-9a-fA-F]{8}-[0-9a-fA-F]{4}-[1-8][0-9a-fA-F]{3}-[89abAB][0-9a-fA-F]{3}-[0-9a-fA-F]{12}|00000000-0000-0000-0000-000000000000|ffffffff-ffff-ffff-ffff-ffffffffffff)$"
				}
			},
			"required": [
				"type"
			],
			"additionalProperties": false,
			"id": "UuidParameter"
		},
		"OperationValuesParameter": {
			"type": "object",
			"properties": {
				"type": {
					"type": "string",
					"const": "operation_values"
				},
				"options_operation": {
					"$ref": "#/$defs/OperationKey"
				},
				"mapping": {
					"$ref": "#/$defs/OperationValuesMapping"
				}
			},
			"required": [
				"type",
				"options_operation",
				"mapping"
			],
			"additionalProperties": false,
			"id": "OperationValuesParameter",
			"description": "A string parameter whose legal values come from a bounded options operation."
		},
		"OperationValuesMapping": {
			"type": "object",
			"properties": {
				"value": {
					"$ref": "#/$defs/FieldName"
				},
				"label_fields": {
					"minItems": 1,
					"maxItems": 4,
					"type": "array",
					"items": {
						"$ref": "#/$defs/FieldName"
					}
				},
				"separator": {
					"type": "string",
					"minLength": 1,
					"maxLength": 16,
					"pattern": "^[^\\x00-\\x1f\\x7f]+$"
				}
			},
			"required": [
				"value",
				"label_fields"
			],
			"additionalProperties": false,
			"id": "OperationValuesMapping",
			"description": "`value` selects the accepted string; `label_fields` are joined in order with `separator`, defaulting to \" · \"."
		},
		"FieldName": {
			"type": "string",
			"minLength": 1,
			"maxLength": 256,
			"pattern": "^[^\\s\\x00-\\x1f\\x7f](?:[^\\x00-\\x1f\\x7f]*[^\\s\\x00-\\x1f\\x7f])?$",
			"id": "FieldName"
		},
		"ArrayParameter": {
			"type": "object",
			"properties": {
				"type": {
					"type": "string",
					"const": "array"
				},
				"items": {
					"$ref": "#/$defs/ArrayParameterItem"
				},
				"min_items": {
					"type": "integer",
					"minimum": 0,
					"maximum": 9007199254740991
				},
				"max_items": {
					"type": "integer",
					"exclusiveMinimum": 0,
					"maximum": 1000
				},
				"default": {
					"type": "array",
					"items": {
						"anyOf": [
							{
								"type": "boolean"
							},
							{
								"type": "number"
							},
							{
								"type": "string"
							}
						]
					}
				}
			},
			"required": [
				"type",
				"items",
				"max_items"
			],
			"additionalProperties": false,
			"id": "ArrayParameter"
		},
		"ArrayParameterItem": {
			"oneOf": [
				{
					"type": "object",
					"properties": {
						"type": {
							"type": "string",
							"const": "boolean"
						}
					},
					"required": [
						"type"
					],
					"additionalProperties": false
				},
				{
					"type": "object",
					"properties": {
						"type": {
							"type": "string",
							"const": "integer"
						},
						"minimum": {
							"type": "integer",
							"minimum": -9007199254740991,
							"maximum": 9007199254740991
						},
						"maximum": {
							"type": "integer",
							"minimum": -9007199254740991,
							"maximum": 9007199254740991
						}
					},
					"required": [
						"type"
					],
					"additionalProperties": false
				},
				{
					"type": "object",
					"properties": {
						"type": {
							"type": "string",
							"const": "number"
						},
						"minimum": {
							"type": "number"
						},
						"maximum": {
							"type": "number"
						}
					},
					"required": [
						"type"
					],
					"additionalProperties": false
				},
				{
					"type": "object",
					"properties": {
						"type": {
							"type": "string",
							"const": "date"
						}
					},
					"required": [
						"type"
					],
					"additionalProperties": false
				},
				{
					"type": "object",
					"properties": {
						"type": {
							"type": "string",
							"const": "timestamp"
						}
					},
					"required": [
						"type"
					],
					"additionalProperties": false
				},
				{
					"type": "object",
					"properties": {
						"type": {
							"type": "string",
							"const": "enum"
						},
						"values": {
							"minItems": 1,
							"type": "array",
							"items": {
								"$ref": "#/$defs/DashboardEnumValue"
							}
						}
					},
					"required": [
						"type",
						"values"
					],
					"additionalProperties": false
				},
				{
					"type": "object",
					"properties": {
						"type": {
							"type": "string",
							"const": "uuid"
						}
					},
					"required": [
						"type"
					],
					"additionalProperties": false
				}
			],
			"id": "ArrayParameterItem"
		},
		"OperationResultSchema": {
			"type": "object",
			"properties": {
				"columns": {
					"minItems": 1,
					"maxItems": 100,
					"type": "array",
					"items": {
						"$ref": "#/$defs/OperationResultColumn"
					}
				}
			},
			"required": [
				"columns"
			],
			"additionalProperties": false,
			"id": "OperationResultSchema"
		},
		"OperationResultColumn": {
			"type": "object",
			"properties": {
				"name": {
					"$ref": "#/$defs/FieldName"
				},
				"type": {
					"type": "string",
					"minLength": 1,
					"maxLength": 128,
					"pattern": "^[^\\s\\x00-\\x1f\\x7f](?:[^\\x00-\\x1f\\x7f]*[^\\s\\x00-\\x1f\\x7f])?$"
				}
			},
			"required": [
				"name",
				"type"
			],
			"additionalProperties": false,
			"id": "OperationResultColumn"
		}
	}
}
